<sl-object xsi:noNamespaceSchemaLocation="../../xsd/sl-object.xsd" xmlns:xsi="http://www.w3.org/2001/XMLSchema-instance"> 
    <title>LandParcelInfo</title>
    <description>Prvovide land parcel information for query position</description>
    <creator>
        <name>Benno Schmidt</name>
        <sl-id>BennoSchmidt</sl-id>
    </creator>
    <primitives>
        <sl-prim>Box</sl-prim>
    </primitives>
    <content>
        <sl-script>/scripts/LandParcelInfo.lsl</sl-script>
    </content>
</sl-object>